{
  "color": {
    "primary": {
      "$type": "color",
      "$value": {
        "colorSpace": "srgb",
        "components": [
          0.8941,
          0.3412,
          0.1804
        ],
        "hex": "#e4572e"
      }
    },
    "secondary": {
      "$type": "color",
      "$value": {
        "colorSpace": "srgb",
        "components": [
          0.1843,
          0.4902,
          0.3098
        ],
        "hex": "#2f7d4f"
      }
    },
    "accent": {
      "$type": "color",
      "$value": {
        "colorSpace": "srgb",
        "components": [
          0.949,
          0.6941,
          0.2039
        ],
        "hex": "#f2b134"
      }
    },
    "background": {
      "$type": "color",
      "$value": {
        "colorSpace": "srgb",
        "components": [
          1.0,
          0.9725,
          0.9333
        ],
        "hex": "#fff8ee"
      }
    },
    "surface": {
      "$type": "color",
      "$value": {
        "colorSpace": "srgb",
        "components": [
          1.0,
          1.0,
          1.0
        ],
        "hex": "#ffffff"
      }
    },
    "text": {
      "$type": "color",
      "$value": {
        "colorSpace": "srgb",
        "components": [
          0.1686,
          0.1294,
          0.0941
        ],
        "hex": "#2b2118"
      }
    },
    "text-muted": {
      "$type": "color",
      "$value": {
        "colorSpace": "srgb",
        "components": [
          0.4353,
          0.3843,
          0.3373
        ],
        "hex": "#6f6256"
      }
    },
    "border": {
      "$type": "color",
      "$value": {
        "colorSpace": "srgb",
        "components": [
          0.9098,
          0.8627,
          0.7961
        ],
        "hex": "#e8dccb"
      }
    },
    "error": {
      "$type": "color",
      "$value": {
        "colorSpace": "srgb",
        "components": [
          0.7529,
          0.2235,
          0.1686
        ],
        "hex": "#c0392b"
      }
    },
    "success": {
      "$type": "color",
      "$value": {
        "colorSpace": "srgb",
        "components": [
          0.1843,
          0.4902,
          0.3098
        ],
        "hex": "#2f7d4f"
      }
    },
    "warning": {
      "$type": "color",
      "$value": {
        "colorSpace": "srgb",
        "components": [
          0.8392,
          0.5373,
          0.0627
        ],
        "hex": "#d68910"
      }
    }
  },
  "font": {
    "heading": {
      "$type": "fontFamily",
      "$value": [
        "Fraunces",
        "Georgia",
        "serif"
      ]
    },
    "body": {
      "$type": "fontFamily",
      "$value": [
        "Inter",
        "system-ui",
        "sans-serif"
      ]
    },
    "mono": {
      "$type": "fontFamily",
      "$value": [
        "JetBrains Mono",
        "ui-monospace",
        "monospace"
      ]
    }
  },
  "radius": {
    "base": {
      "$type": "dimension",
      "$value": {
        "value": 12,
        "unit": "px"
      }
    }
  },
  "spacing": {
    "base": {
      "$type": "dimension",
      "$value": {
        "value": 8,
        "unit": "px"
      }
    }
  },
  "shadow": {
    "sm": {
      "$type": "shadow",
      "$value": {
        "color": {
          "colorSpace": "srgb",
          "components": [
            0.17,
            0.13,
            0.09
          ],
          "alpha": 0.08,
          "hex": "#2b2118"
        },
        "offsetX": {
          "value": 0,
          "unit": "px"
        },
        "offsetY": {
          "value": 1,
          "unit": "px"
        },
        "blur": {
          "value": 2,
          "unit": "px"
        },
        "spread": {
          "value": 0,
          "unit": "px"
        }
      }
    },
    "md": {
      "$type": "shadow",
      "$value": {
        "color": {
          "colorSpace": "srgb",
          "components": [
            0.17,
            0.13,
            0.09
          ],
          "alpha": 0.12,
          "hex": "#2b2118"
        },
        "offsetX": {
          "value": 0,
          "unit": "px"
        },
        "offsetY": {
          "value": 4,
          "unit": "px"
        },
        "blur": {
          "value": 12,
          "unit": "px"
        },
        "spread": {
          "value": 0,
          "unit": "px"
        }
      }
    },
    "lg": {
      "$type": "shadow",
      "$value": {
        "color": {
          "colorSpace": "srgb",
          "components": [
            0.17,
            0.13,
            0.09
          ],
          "alpha": 0.18,
          "hex": "#2b2118"
        },
        "offsetX": {
          "value": 0,
          "unit": "px"
        },
        "offsetY": {
          "value": 12,
          "unit": "px"
        },
        "blur": {
          "value": 32,
          "unit": "px"
        },
        "spread": {
          "value": 0,
          "unit": "px"
        }
      }
    }
  },
  "$extensions": {
    "ai.skaile": {
      "mode": "light",
      "approved": "2026-10-24"
    }
  }
}
